{
  "$schema": "http://json-schema.org/draft-07/schema#",
  "title": "Solon Playbook",
  "description": "Schema for Solon AI code review playbooks",
  "type": "object",
  "required": ["name", "version", "description", "author", "tags", "rules"],
  "properties": {
    "name": {
      "type": "string",
      "description": "Display name of the playbook"
    },
    "version": {
      "type": "string",
      "pattern": "^\\d+\\.\\d+\\.\\d+$",
      "description": "Semantic version of the playbook"
    },
    "description": {
      "type": "string",
      "description": "What this playbook covers and who it is for"
    },
    "author": {
      "type": "string",
      "description": "Author or organization"
    },
    "tags": {
      "type": "array",
      "items": { "type": "string" },
      "minItems": 1,
      "description": "Tags for discovery and filtering"
    },
    "rules": {
      "type": "array",
      "minItems": 1,
      "items": {
        "type": "object",
        "required": ["id", "title", "severity", "description", "examples"],
        "properties": {
          "id": {
            "type": "string",
            "pattern": "^[a-z0-9-]+$",
            "description": "Unique kebab-case identifier for this rule"
          },
          "title": {
            "type": "string",
            "description": "Short, actionable rule title"
          },
          "severity": {
            "type": "string",
            "enum": ["blocking", "warning", "info"],
            "description": "blocking = PR cannot merge, warning = flagged but not blocked, info = informational only"
          },
          "description": {
            "type": "string",
            "description": "Full explanation of the rule, why it matters, and when it applies"
          },
          "examples": {
            "type": "object",
            "required": ["bad", "good"],
            "properties": {
              "bad": {
                "type": "string",
                "description": "Example of code that violates this rule"
              },
              "good": {
                "type": "string",
                "description": "Example of code that satisfies this rule"
              }
            }
          }
        }
      }
    }
  }
}
