{
  "name": "Accessibility (WCAG 2.2)",
  "version": "1.0.0",
  "description": "Enforces WCAG 2.2 Level AA compliance in React and Next.js codebases. Catches the most common accessibility violations that automated tools miss — semantic HTML, keyboard navigation, screen reader support, and color contrast requirements.",
  "author": "Solon AI",
  "tags": ["accessibility", "wcag", "a11y", "react", "nextjs"],
  "rules": [
    {
      "id": "images-require-alt-text",
      "title": "All images must have descriptive alt text",
      "severity": "blocking",
      "description": "Every <img> and next/image component must have an alt attribute. Decorative images should use alt='' (empty string). Missing or placeholder alt text (e.g. alt='image') fails WCAG 1.1.1.",
      "examples": {
        "bad": "<Image src='/hero.png' /> or <img src='/logo.png' alt='image' />",
        "good": "<Image src='/hero.png' alt='Team working in a modern office' /> or <img src='/logo.png' alt='Solon AI logo' />"
      }
    },
    {
      "id": "interactive-elements-keyboard-accessible",
      "title": "All interactive elements must be keyboard accessible",
      "severity": "blocking",
      "description": "Buttons, links, modals, dropdowns, and custom controls must be operable via keyboard alone (Tab, Enter, Space, Arrow keys). Never use onClick on non-interactive elements like <div> without also handling onKeyDown.",
      "examples": {
        "bad": "<div onClick={handleClick}>Click me</div>",
        "good": "<button onClick={handleClick}>Click me</button> or <div role='button' tabIndex={0} onClick={handleClick} onKeyDown={(e) => e.key === 'Enter' && handleClick()}>Click me</div>"
      }
    },
    {
      "id": "form-inputs-require-labels",
      "title": "All form inputs must have associated labels",
      "severity": "blocking",
      "description": "Every <input>, <select>, and <textarea> must have a visible <label> element or an aria-label/aria-labelledby attribute. Placeholder text alone does not count as a label.",
      "examples": {
        "bad": "<input type='email' placeholder='Enter your email' />",
        "good": "<label htmlFor='email'>Email address</label><input id='email' type='email' placeholder='Enter your email' />"
      }
    },
    {
      "id": "use-semantic-html",
      "title": "Use semantic HTML elements over generic divs",
      "severity": "warning",
      "description": "Use <nav>, <main>, <header>, <footer>, <article>, <section>, <aside>, <button>, <h1>-<h6> appropriately. Generic <div> and <span> elements have no semantic meaning for assistive technologies.",
      "examples": {
        "bad": "<div class='navigation'><div class='nav-item'>Home</div></div>",
        "good": "<nav><ul><li><a href='/'>Home</a></li></ul></nav>"
      }
    },
    {
      "id": "heading-hierarchy",
      "title": "Heading levels must follow a logical hierarchy",
      "severity": "warning",
      "description": "Headings must not skip levels (e.g., jumping from h1 to h3). Each page should have exactly one h1. Heading levels communicate document structure to screen reader users.",
      "examples": {
        "bad": "<h1>Page Title</h1><h3>Section</h3><h5>Subsection</h5>",
        "good": "<h1>Page Title</h1><h2>Section</h2><h3>Subsection</h3>"
      }
    },
    {
      "id": "focus-visible",
      "title": "Focus indicators must be visible",
      "severity": "blocking",
      "description": "Never use 'outline: none' or 'outline: 0' without providing an alternative visible focus indicator. Keyboard users rely on focus rings to know where they are on the page. WCAG 2.2 requires focus to be visible.",
      "examples": {
        "bad": "button:focus { outline: none; }",
        "good": "button:focus-visible { outline: 2px solid #005FCC; outline-offset: 2px; }"
      }
    },
    {
      "id": "aria-roles-used-correctly",
      "title": "ARIA roles and attributes must be used correctly",
      "severity": "warning",
      "description": "ARIA attributes must match the element's role and state. Invalid or redundant ARIA (e.g., role='button' on a <button>) can confuse assistive technologies. When in doubt, use native HTML elements instead.",
      "examples": {
        "bad": "<button role='button' aria-label='submit'>Submit</button>",
        "good": "<button type='submit'>Submit</button>"
      }
    },
    {
      "id": "modals-trap-focus",
      "title": "Modals and dialogs must trap focus",
      "severity": "blocking",
      "description": "When a modal opens, focus must be moved inside it and trapped there until it closes. Tab and Shift+Tab must cycle through focusable elements within the modal only. On close, focus must return to the trigger element.",
      "examples": {
        "bad": "A custom modal that renders over the page but allows Tab to reach elements behind it.",
        "good": "Use a library like @radix-ui/react-dialog or headlessui/react that handles focus trapping, or implement FocusTrap manually with a ref."
      }
    },
    {
      "id": "color-not-sole-indicator",
      "title": "Color must not be the only visual indicator of meaning",
      "severity": "warning",
      "description": "Error states, success states, required fields, and other meaningful UI states must use text, icons, or patterns in addition to color. Users with color blindness cannot distinguish color alone.",
      "examples": {
        "bad": "<input style={{ borderColor: hasError ? 'red' : 'green' }} />",
        "good": "<input style={{ borderColor: hasError ? 'red' : 'green' }} aria-describedby='email-error' />{hasError && <span id='email-error' role='alert'>Please enter a valid email</span>}"
      }
    },
    {
      "id": "links-descriptive-text",
      "title": "Link text must be descriptive",
      "severity": "warning",
      "description": "Link text must describe the destination or action, not just say 'click here', 'read more', or 'here'. Screen reader users often navigate by listing all links on a page — vague text is meaningless out of context.",
      "examples": {
        "bad": "<a href='/blog/post-1'>Read more</a>",
        "good": "<a href='/blog/post-1'>Read more about our deployment strategy</a>"
      }
    },
    {
      "id": "live-regions-for-dynamic-content",
      "title": "Dynamic content updates must use ARIA live regions",
      "severity": "warning",
      "description": "When content updates without a page reload (toast notifications, form errors, loading states, search results), use aria-live='polite' or aria-live='assertive' so screen readers announce the change.",
      "examples": {
        "bad": "<div>{successMessage}</div>",
        "good": "<div role='status' aria-live='polite'>{successMessage}</div>"
      }
    }
  ]
}
